{
  "route": "database_query",
  "confidence": 0.88,
  "queried_database": true,
  "execution_status": "success",
  "has_risk": false,
  "degraded": false,
  "degrade_reason": "",
  "selected_databases": ["erp_db", "wms_db"],
  "trace_id": "3fd2c7a10b9e4a55",
  "steps": [
    {"database": "erp_db", "sql": "SELECT job_no FROM job WHERE customer_id = 'C0007'",
     "final_sql": "SELECT job_no FROM job WHERE customer_id = 'C0007'",
     "success": true, "row_count": 2, "truncated": false,
     "rows": [{"job_no": "J25-00003"}, {"job_no": "J25-00007"}],
     "error": null, "repair_attempts": [], "risk_findings": []},
    {"database": "wms_db", "sql": "SELECT job_no, qty FROM stock WHERE job_no IN ('J25-00003','J25-00007')",
     "final_sql": "SELECT job_no, qty FROM stock WHERE job_no IN ('J25-00003','J25-00007')",
     "success": true, "row_count": 2, "truncated": false,
     "rows": [{"job_no": "J25-00003", "qty": 12}, {"job_no": "J25-00007", "qty": 0}],
     "error": null, "repair_attempts": [], "risk_findings": []}
  ]
}
